id,subreddit,body
eyu2ec,GYM,
fgvlsrc,GYM,thank help get start week
fjx7ami,GYM,look like good start good effort plan differenti sub fit base one particular r fit big bias toward lift gym work kind sub too
fjyy9a5,GYM,r fit fantast wiki https thefit wiki constant ad to
lngehn,GYM,
go0egeq,GYM,look good angl pleas dont look much deadlift head either straight forward line bodi sorta neutral
go0feuy,GYM,great work tri look toward sky deadlift
go0ex82,GYM,what interest ceil great weight tho
go0wv2y,GYM,impress would say put chin want keep spine align entir lift
go14wnb,GYM,coach alway tell us look around much add weight
go0t6en,GYM,that great notic missgroov touch go perhap let weight go dead everi rep see feel dont afriad widen stanc tini tini bit knee go toward insid elbow
go0i30n,GYM,like way your feel end d
go0nhxi,GYM,smug face pull pb good lift
go0z08e,GYM,look close notic girl
go12buk,GYM,yes girl
go11td7,GYM,back postur awesom stop weight dead attempt dont want cheat bounc momentum solid lift though
go0l64g,GYM,attract deadlift
go17way,GYM,back littl curv tri keep straight natur keep chin down
lnkdrg,GYM,
go1pap5,GYM,soo true rememb mani week week look forward bench set warm up
go1qd5o,GYM,even better old max start warmup
go1r0fc,GYM,definit nice see hard work turn result
lmwjdp,GYM,
gny5t35,GYM,turn white
gnyqc5h,GYM,good dude
gnzlof5,GYM,cring hard watch first video great progress
gnxfdzf,GYM,obvious back round first video rep minim back round third rep second video
gny36xa,GYM,awesom progress help make form effici
go0zcoe,GYM,nice dude want get that good work
gnz1452,GYM,delet
gnyrbdn,GYM,thank homi
go0cjkf,GYM,hey wasnt bad
gny3s0f,GYM,thank would lie pinpoint exact thing help start paus deadlift huntch could help googl found case start paus deadlift optim exercis twice per week first week train block tri beltless rep per set still play around stanc stanc second video shoulder width toe point let say left right im still find optim stanc felt rli good realli creat tremend amount stif lat it
gnzsfla,GYM,low weight warm sure north lbs definit time use one
gnzrggx,GYM,get benefit wear belt what harm wear sake save back
gnypwi8,GYM,possibl learn power
gnz4594,GYM,anytim man
gnyrc6k,GYM,your welcom
gnyq0c3,GYM,thank deadlift exact like first vid given month tri better form
go0cerx,GYM,belt prevent injuri make core weaker help lift bit weight that it
gnyrdy3,GYM,bought power cent aliexpress time deal
gnyrap5,GYM,good luck man
lnol1a,GYM,
lnogvv,GYM,basic last year feel bit low realli know becom better sinc never face start note activ googl doc slowli start rate felt interact soon start notic pattern felt better hung peopl certain activ way abl feel much better gain confid control mental health even built app peopl app call happyer made base experi provid insight impact given activ friend https play googl com store app detailsid com happyer life https play googl com store app detailsid com happyer life android https app appl com ca app happyer id https app appl com ca app happyer id io
lnbqal,GYM,
go00sln,GYM,tri keep neck neutral spine avoid look up
go0eqqt,GYM,apart peopl said look heal touch floor entir lift u tri get flat foot shoe even deadlift shoe coushin
go198m6,GYM,lock arm straight look bent deadlift bent arm great way tear bicep tendon
gnzthae,GYM,leg lock way hip lock time like fluid motion
go01xy0,GYM,realli hurt way your look natur want watch lift quit harm
lnqbxs,GYM,
lnq0jz,GYM,new gym scare back injuri tip hellllo f go gym year worri back injuri mani friend injur month physio constant pain lift extrem heavi think perfect form get anxious movement like squat smith machin exampl fair fit use run etc weight train feel like whole new ball game tip avoid quick slowli increas weight particular movement avoid pay session pt ott thank advanc x
go1r7gt,GYM,start light weight first get comfort form comfort start adjust heavier weight slowli weight sacrific form your lift heavi movement weight make sure back alway straight possibl dont rotat swing bodi lift weight get slip disk
lnph9c,GYM,im start lift year ago quit late know im cm reduc weight kg kg lb current weight stop kcal dont know reduc calori per day tri reduc even bf add calori tri gain muscl im worri might lose progress burn muscl covid situat access quit light weight exercis home repetit seri light weight give advic pleas https preview redd kja oshi pngwidth format png auto webp dd cebdc b bc
go1oq2m,GYM,bf doesnt seem high go cut suggest would go build muscl keep eat mainten calori keep resist train
